<?xml version="1.0" encoding="UTF-8"?>
<xs:schema xmlns:xs="http://www.w3.org/2001/XMLSchema">
    <xs:element name="hardwareCatalog">
        <xs:complexType>
            <xs:sequence>
                <xs:element name="item" minOccurs="5" maxOccurs="unbounded">
                    <xs:complexType>
                        <xs:sequence>
                            <xs:element name="id" type="xs:integer"/>
                            <xs:element name="type" type="xs:string"/>
                            <xs:element name="brand" type="xs:string"/>
                            <xs:element name="model" type="xs:string"/>
                            <xs:element name="specifications" type="xs:string"/>
                        </xs:sequence>
                    </xs:complexType>
                </xs:element>
            </xs:sequence>
        </xs:complexType>
    </xs:element>
</xs:schema>